text,intent,encoded_intent
want wednesday flights atlanta washington dc,atis_flight,4
nonstop flights kansas city paul,atis_flight,4
okay show flights baltimore,atis_flight,4
flights pittsburgh baltimore pm,atis_flight,4
like return flight denver atlanta evening flights,atis_flight,4
american flights cincinnati salt lake city,atis_flight,4
list flights depart general mitchell international,atis_flight,4
minneapolis phoenix monday,atis_flight,4
show dallas ground transport,atis_ground_service,6
flights available monday san francisco pittsburgh,atis_flight,4
flights pittsburgh los angeles thursday evening,atis_flight,4
need fly washington san francisco like stop dallas tell schedule flights,atis_flight,4
cheapest round trip fare dallas baltimore,atis_airfare,2
please list nonstop flights las vegas new york america west,atis_flight,4
like see flights baltimore atlanta arrive noon like see flights denver atlanta arrive noon,atis_flight,4
okay november twenty third want fly atlanta denver need know flights available,atis_flight,4
kind plane flies boston pittsburgh noon,atis_aircraft,1
flight denver salt lake city,atis_flight,4
flights boston pittsburgh wednesday next week later pm,atis_flight,4
flight information oakland denver,atis_flight,4
would like flight denver san francisco leaving denver afternoon arriving pm must nonstop flight,atis_flight,4
flights available philadelphia denver wednesday economy class,atis_flight,4
united airlines flight miami washington dc arriving around noon,atis_flight,4
show flights new york milwaukee,atis_flight,4
ground transportation available denver,atis_ground_service,6
could listing flights leaving boston going baltimore leaving wednesday,atis_flight,4
ground transportation available atlanta,atis_ground_service,6
stand meals,atis_abbreviation,0
show airlines flights denver dallas,atis_airline,3
first class round trip airfare indianapolis memphis,atis_airfare,2
much flight ua denver san francisco cost,atis_airfare,2
need round trip flight cincinnati san jose california,atis_flight,4
northwest airline flights leave denver noon,atis_flight,4
show return flights cincinnati salt lake city nonstop,atis_flight,4
flight leaving boston atlanta,atis_flight,4
show list flights july twenty second leaving dc dallas leaving dc pm,atis_flight,4
question want go san francisco live denver would like fly united airlines early flight,atis_flight,4
show flights pittsburgh san francisco,atis_flight,4
flights dallas houston,atis_flight,4
show flights boston washington,atis_flight,4
show flights boston denver arrive denver wednesday noon,atis_flight,4
list possible round trip daily flights boston oakland,atis_flight,4
please show airlines service boston denver,atis_airline,3
fares flights atlanta dfw provided delta airlines,atis_airfare,2
show one time first class fares baltimore dallas,atis_airfare,2
choices flights get charlotte minneapolis arriving pm minneapolis,atis_flight,4
tell flights baltimore dallas,atis_flight,4
want find flight boston atlanta,atis_flight,4
ground transportation airport downtown boston,atis_ground_service,6
flights memphis las vegas arrive sunday,atis_flight,4
would like fly dallas san francisco saturday arrive san francisco pm,atis_flight,4
flights dallas boston tomorrow night evening,atis_flight,4
flight denver boston,atis_flight,4
show flights san francisco dallas continental airlines,atis_flight,4
find flights nonstop boston dallas,atis_flight,4
show fare dallas san francisco,atis_airfare,2
want know flights available coach economy class baltimore dallas,atis_flight,4
show american flights dallas san francisco,atis_flight,4
cheapest flight pittsburgh atlanta one way,atis_flight,4
show prices flights baltimore dallas july twenty ninth,atis_airfare,2
flights available dallas fort worth atlanta,atis_flight,4
looking flights toronto san diego,atis_flight,4
tomorrow atlanta san francisco,atis_flight,4
flight leaves dallas atlanta august twenty seventh evening,atis_flight,4
list flights boston oakland,atis_flight,4
latest flight san francisco atlanta,atis_flight,4
philadelphia boston monday,atis_flight,4
want flight los angeles charlotte leaves weekday morning,atis_flight,4
ground transport denver,atis_ground_service,6
would like flight denver san francisco leaving denver afternoon arriving pm,atis_flight,4
ground transportation available baltimore day tomorrow,atis_ground_service,6
would like afternoon flight leaving tuesday san diego indianapolis,atis_flight,4
earliest flight thursday atlanta washington dc,atis_flight,4
latest flight leaving washington denver,atis_flight,4
find travel arrangements round trip flight dallas pittsburgh arriving pm pm,atis_flight,4
give flight charlotte baltimore tuesday morning,atis_flight,4
looking flights pittsburgh philadelphia leaving,atis_flight,4
fare code qo mean,atis_abbreviation,0
flights baltimore san francisco,atis_flight,4
would like fly salt lake city back petersburg wednesday,atis_flight,4
would like afternoon flight denver colorado dallas texas,atis_flight,4
list flights chicago louis depart noon,atis_flight,4
afternoon flights boston san francisco please leave afternoon,atis_flight,4
like flight information dallas fort worth boston tuesday,atis_flight,4
ground transportation phoenix,atis_ground_service,6
want go boston washington monday morning,atis_flight,4
display types aircraft departing cleveland dallas noon,atis_aircraft,1
know car rental denver,atis_ground_service,6
flights montreal,atis_flight,4
airline nw,atis_airline,3
display flights leaving toronto san diego us air laying washington dc,atis_flight,4
like limo denver august seventh,atis_ground_service,6
would like fly dallas denver morning august twenty seventh leaving,atis_flight,4
need flight tonight charlotte las vegas stop louis want dinner,atis_flight,4
fly philadelphia dallas saturday morning,atis_flight,4
give continental flights seattle,atis_flight,4
fare code h,atis_abbreviation,0
ground transportation baltimore,atis_ground_service,6
show flights pittsburgh philadelphia,atis_flight,4
continental flights go chicago seattle morning meal,atis_flight,4
show latest flight denver boston,atis_flight,4
show flights san francisco philadelphia september fifteenth,atis_flight,4
flights toronto philadelphia,atis_flight,4
show wednesday afternoon flights denver san francisco,atis_flight,4
much cost fly american dallas baltimore,atis_airfare,2
cheapest one way fare boston oakland,atis_airfare,2
many fares one way tacoma montreal,atis_quantity,7
flight denver philadelphia,atis_flight,4
like fly early tomorrow columbus minneapolis,atis_flight,4
show economy flights baltimore dallas,atis_flight,4
show flights pittsburgh dc,atis_flight,4
philadelphia san francisco next week tuesday show flights,atis_flight,4
earliest nonstop flight washington san francisco,atis_flight,4
show flights baltimore dallas,atis_flight,4
flight milwaukee chicago,atis_flight,4
ewr stand,atis_abbreviation,0
would like information flights dallas fort worth atlanta wednesday morning,atis_flight,4
dinner flights indianapolis san diego wednesday may twelfth,atis_flight,4
show flights denver philadelphia,atis_flight,4
show delta flights dallas denver,atis_flight,4
tell ground transportation salt lake city,atis_ground_service,6
show flights philadelphia denver monday,atis_flight,4
us baltimore philadelphia fare,atis_airfare,2
okay tell flight cost denver atlanta,atis_flight,4
ls stand,atis_abbreviation,0
show flights charlotte columbus,atis_flight,4
list flights friday afternoon philadelphia oakland,atis_flight,4
show flights love field,atis_flight,4
would like book flight august twenty seventh baltimore san francisco us air,atis_flight,4
flights land general mitchell international,atis_flight,4
want flights atlanta washington dc thursday,atis_flight,4
please show fares denver san francisco,atis_airfare,2
limousine service toronto,atis_ground_service,6
show round trip fares new york miami,atis_airfare,2
long ground transportation take salt lake city airport,atis_ground_service,6
newark cleveland daily,atis_flight,4
would like schedule flight american airlines philadelphia san francisco makes stop denver,atis_flight,4
interested flying boston atlanta,atis_flight,4
airline flight originating atlanta november seventh noon arriving san francisco pm,atis_airline,3
list flights washington dc tampa florida,atis_flight,4
show flights boston dallas,atis_flight,4
want flight milwaukee orlando one way leaving pm wednesday,atis_flight,4
flights pittsburgh atlanta lowest coach class fares,atis_flight,4
like know earliest flight boston san francisco,atis_flight,4
rent car stapleton international airport denver,atis_ground_service,6
okay like flight boston san francisco leaves,atis_flight,4
want go denver atlanta round trip make stop pittsburgh may cheapest fare,atis_flight,4
delta flight boston denver,atis_flight,4
would like fly delta airlines atlanta pittsburgh,atis_flight,4
flights boston baltimore washington,atis_flight,4
would like fly denver pittsburgh atlanta,atis_flight,4
breakfast flight philadelphia dallas via atlanta,atis_flight,4
cheapest fare one way pittsburgh denver,atis_airfare,2
flights petersburg toronto monday,atis_flight,4
list flights boston pittsburgh leaving early morning august sixth,atis_flight,4
mco,atis_abbreviation,0
please show flights dallas denver,atis_flight,4
need flight thursday oakland salt lake city,atis_flight,4
show flights boston san francisco arriving pm,atis_flight,4
last flight washington boston,atis_flight,4
flight oakland boston stopover dallas fort worth twa,atis_flight,4
would like nonstop flight philadelphia pittsburgh,atis_flight,4
would like nonstop flight memphis las vegas march second,atis_flight,4
earliest flight nashville tacoma american tuesday eighteenth may,atis_flight,4
show evening flights philadelphia baltimore,atis_flight,4
nonstop flights leaving dallas baltimore july seventh united airlines,atis_flight,4
show flights cleveland miami arrive pm,atis_flight,4
twa flight leaving early morning san francisco denver,atis_flight,4
cheapest coach fare dallas denver round trip,atis_airfare,2
flights milwaukee phoenix saturday,atis_flight,4
early morning flights boston denver,atis_flight,4
would like find cheapest one way fare boston oakland,atis_airfare,2
latest flight washington dc denver,atis_flight,4
flights pittsburgh baltimore pm,atis_flight,4
planes united use,atis_aircraft,1
show flight san francisco oakland,atis_flight,4
find travel arrangements round trip flight boston pittsburgh,atis_flight,4
american airline fly denver pittsburgh,atis_flight,4
show daily flights milwaukee orlando,atis_flight,4
list flights denver san francisco denver philadelphia,atis_flight,4
would like flight continental airlines leaving boston making stop denver arriving san francisco,atis_flight,4
show flights chicago indianapolis,atis_flight,4
flights baltimore pm,atis_flight,4
flight wednesday denver washington dc nonstop,atis_flight,4
like fly boston fort worth,atis_flight,4
show ground transportation westchester county,atis_ground_service,6
airlines service pittsburgh airport,atis_airline,3
please list flight times pittsburgh newark,atis_flight_time,5
fare november seventh going one way pittsburgh philadelphia,atis_airfare,2
flying pittsburgh atlanta september fourth would cheapest flight,atis_flight,4
fare washington boston,atis_airfare,2
delta airlines fly pittsburgh atlanta,atis_flight,4
show flights boston san francisco,atis_flight,4
united flight dallas san francisco,atis_flight,4
show flights philadelphia denver sunday leave philadelphia noon,atis_flight,4
show flights dallas san francisco wednesdays,atis_flight,4
type aircraft leaves boston washington dc,atis_aircraft,1
flights twa columbus louis,atis_flight,4
flights cleveland indianapolis wednesday twelfth,atis_flight,4
want travel philadelphia boston wednesday afternoon,atis_flight,4
like go detroit san diego wednesday evening june second,atis_flight,4
show flights denver boston thursday,atis_flight,4
want list daily flights milwaukee louis,atis_flight,4
much first class ticket cost boston san francisco round trip,atis_airfare,2
please show cost flight ua boston denver flight ua boston denver,atis_airfare,2
show flights leaving miami cleveland us air leave noon,atis_flight,4
please show flights atlanta oakland california thursday hours,atis_flight,4
flights washington dc san francisco pm november twelfth economy class,atis_flight,4
earliest flight american airlines washington dc san francisco,atis_flight,4
flights boston pittsburgh wednesday next week pm,atis_flight,4
list wednesday flights denver baltimore arriving baltimore pm,atis_flight,4
earliest flight boston dallas fort worth leaving august eighth,atis_flight,4
first class fare round trip atlanta denver,atis_airfare,2
first class fares boston pittsburgh thursday,atis_airfare,2
flights montreal las vegas,atis_flight,4
need go boston dallas,atis_flight,4
afternoon flights denver san francisco,atis_flight,4
list flights denver baltimore,atis_flight,4
nonstop flights available oakland pittsburgh,atis_flight,4
options minneapolis back indianapolis flight around noontime,atis_flight,4
show flights san diego newark,atis_flight,4
okay want flight originating denver going pittsburgh,atis_flight,4
flights philadelphia denver wednesdays,atis_flight,4
flights available friday san francisco boston,atis_flight,4
show flights pittsburgh boston leave noon,atis_flight,4
need take ten people denver phoenix please give flights week,atis_flight,4
would like travel boston denver early morning,atis_flight,4
flights salt lake city las vegas,atis_flight,4
list ground transportation detroit,atis_ground_service,6
flights available tuesday afternoon pittsburgh atlanta,atis_flight,4
nonstop connecting flights seattle boston,atis_flight,4
flights cincinnati tampa,atis_flight,4
flights denver colorado pittsburgh pennsylvania,atis_flight,4
ea mean,atis_abbreviation,0
flight nashville houston evening tomorrow,atis_flight,4
latest flight departing dallas philadelphia,atis_flight,4
show flights milwaukee orlando wednesday pm,atis_flight,4
give lowest fare atlanta denver may seventh please,atis_airfare,2
show cheapest flights baltimore dallas,atis_flight,4
first flight leaving oakland boston,atis_flight,4
find flights philadelphia dallas stopping atlanta,atis_flight,4
list american airlines flights newark nashville,atis_flight,4
may see flights washington san francisco please,atis_flight,4
show flights love field,atis_flight,4
would like information flight denver san francisco united airlines,atis_flight,4
planes used twa,atis_aircraft,1
want flight long beach louis stops dallas,atis_flight,4
like see one way flights denver pittsburgh,atis_flight,4
like flights american airlines philadelphia dallas arriving,atis_flight,4
please inform type aircraft used flight atlanta denver noon,atis_aircraft,1
fare code mean,atis_abbreviation,0
morning flights boston philadelphia,atis_flight,4
first class flight san francisco american airlines tuesday next week,atis_flight,4
need information flights tuesday leaving baltimore dallas dallas boston boston baltimore,atis_flight,4
ap restriction,atis_abbreviation,0
show flights pittsburgh philadelphia,atis_flight,4
direct flights atlanta philadelphia arriving philadelphia noon,atis_flight,4
earliest flight oakland washington dc sunday,atis_flight,4
airlines fly boston pittsburgh,atis_airline,3
want flight toronto san diego stops louis flights,atis_flight,4
could please tell cheapest flight boston san francisco,atis_flight,4
las vegas montreal,atis_flight,4
northwest airline flights leave denver noon,atis_flight,4
show flights united airlines san francisco denver washington dc,atis_flight,4
latest flight philadelphia boston,atis_flight,4
times continental depart boston san francisco,atis_flight_time,5
like see flights pittsburgh philadelphia,atis_flight,4
cheapest fare denver pittsburgh,atis_airfare,2
list flights denver philadelphia,atis_flight,4
please show flights arriving philadelphia denver,atis_flight,4
flights milwaukee tampa,atis_flight,4
flights baltimore washington dc,atis_flight,4
give cheapest flight dallas baltimore saturday,atis_flight,4
expensive first class tickets atlanta dallas,atis_airfare,2
show flights san diego san francisco southwest airlines,atis_flight,4
list daily flights denver baltimore first class service,atis_flight,4
show flights arriving charlotte around pm next monday please,atis_flight,4
many first class flights united leaving airports today,atis_quantity,7
many flights airline booking class k,atis_quantity,7
may fly san francisco baltimore,atis_flight,4
like make round trip la newark way charlotte,atis_flight,4
flight information san francisco pittsburgh,atis_flight,4
coach fares weekdays denver boston,atis_airfare,2
list lowest cost flight dallas baltimore,atis_flight,4
would like fly boston atlanta,atis_flight,4
many cities served delta airlines first class flights,atis_quantity,7
please give flight schedules pittsburgh philadelphia,atis_flight,4
show ground transportation denver,atis_ground_service,6
flights go philadelphia san francisco via dallas,atis_flight,4
flight dallas boston tomorrow,atis_flight,4
american flights cincinnati houston,atis_flight,4
flights leaving atlanta oakland leaving pm,atis_flight,4
friday need see flights leave atlanta arrive dallas pm,atis_flight,4
show flights new york miami tuesday round trip fare less dollars,atis_flight,4
looking flight boston denver stopovers afternoon,atis_flight,4
like flights american philadelphia dallas arriving,atis_flight,4
list flights long beach columbus sunday,atis_flight,4
give nonstops new york city las vegas arrive sunday,atis_flight,4
flights boston san francisco leaving tomorrow,atis_flight,4
need flight tuesday phoenix detroit,atis_flight,4
earliest flight washington san francisco,atis_flight,4
find flight boston oakland stopping denver,atis_flight,4
okay let see flight delta airline atlanta boston,atis_flight,4
flight salt lake city petersburg june second,atis_flight,4
show nonstop flights dallas houston,atis_flight,4
list flights departing las vegas arriving san diego,atis_flight,4
first flight boston san francisco,atis_flight,4
flights northwest united airlines stop denver noon,atis_flight,4
flights newark new jersey cleveland ohio,atis_flight,4
cheapest round trip flight atlanta pittsburgh,atis_flight,4
show cheapest fares new york miami leaving tuesday,atis_airfare,2
show flights ontario tacoma one way,atis_flight,4
list united flights denver oakland,atis_flight,4
cheapest fare baltimore dallas class,atis_airfare,2
give latest flight tomorrow united airlines milwaukee tacoma,atis_flight,4
okay like nonstop flight houston memphis arrives memphis early afternoon tuesday june first,atis_flight,4
would like travel washington dc pittsburgh august twentieth,atis_flight,4
airlines flies atlanta,atis_airline,3
find nonstop flight denver oakland leaving afternoon arriving near pm,atis_flight,4
flights go baltimore newark wednesday morning,atis_flight,4
list flights arriving boston atlanta august fifth,atis_flight,4
time flight aa depart,atis_flight_time,5
also need go san francisco wednesday evening dallas,atis_flight,4
list flights long beach columbus late saturday,atis_flight,4
please give flights long beach california memphis tennessee,atis_flight,4
flight charlotte atlanta june first,atis_flight,4
show flights dallas baltimore economy fares,atis_flight,4
flights las vegas phoenix saturday,atis_flight,4
hi calling boston like make flight either orlando los angeles,atis_flight,4
flights new york city las vegas,atis_flight,4
ground transportation available pittsburgh,atis_ground_service,6
show flights pittsburgh oakland arrive,atis_flight,4
please give flights atlanta boston wednesday morning thursday afternoon,atis_flight,4
flight milwaukee denver,atis_flight,4
designate meal,atis_abbreviation,0
would like find flight goes tampa montreal making stop new york flight serves lunch,atis_flight,4
okay want know cheapest fare atlanta boston,atis_airfare,2
list flights leaving san francisco monday afternoon arriving pittsburgh,atis_flight,4
give flights without fares atlanta baltimore,atis_flight,4
show fares delta flights dallas san francisco,atis_airfare,2
latest evening flight leaving san francisco washington,atis_flight,4
first flight boston atlanta last flight atlanta boston,atis_flight,4
classes service delta airlines,atis_flight,4
please list flights tuesday dallas atlanta,atis_flight,4
philadelphia san francisco please,atis_flight,4
airlines fly boston baltimore,atis_airline,3
need spend much day ground atlanta find early flight boston lastest possible flight back atlanta,atis_flight,4
delta airline fly denver pittsburgh,atis_flight,4
list flights boston atlanta thursday,atis_flight,4
list flights baltimore san francisco friday,atis_flight,4
show flights denver philadelphia,atis_flight,4
hou mean,atis_abbreviation,0
show flights san francisco new york nonstop,atis_flight,4
need flight phoenix detroit leaving monday evening,atis_flight,4
would like book flight chicago seattle june fourth,atis_flight,4
show flights delta atlanta morning,atis_flight,4
earliest flight phoenix salt lake city,atis_flight,4
want fly kansas city chicago next wednesday arriving evening returning next day,atis_flight,4
please list sunday flights dallas houston american airlines,atis_flight,4
flights leave san francisco pm go dallas fort worth,atis_flight,4
ground transportation available newark,atis_ground_service,6
show flights fares pittsburgh san francisco,atis_flight,4
want fly philadelphia dallas july eighth,atis_flight,4
would like travel boston denver,atis_flight,4
flights go pittsburgh denver pm,atis_flight,4
like twa flight las vegas new york nonstop,atis_flight,4
would like see flights denver philadelphia,atis_flight,4
boston pittsburgh,atis_flight,4
flights washington dc san francisco november twelfth,atis_flight,4
kind ground transportation available las vegas,atis_ground_service,6
show evening flights philadelphia baltimore,atis_flight,4
much cost fly directly philadelphia san francisco american airlines,atis_airfare,2
please list flight times newark boston,atis_flight_time,5
flights delta boston san francisco,atis_flight,4
give flights san francisco washington dc december first,atis_flight,4
would like information flights leaving atlanta arriving dallas,atis_flight,4
please show flights washington dc san francisco california,atis_flight,4
flights seattle salt lake city,atis_flight,4
flights montreal phoenix las vegas arriving time,atis_flight,4
show flights milwaukee orlando wednesday evening thursday mornings,atis_flight,4
list nonstop flights miami washington dc,atis_flight,4
list flights departing toronto landing san diego stopover denver,atis_flight,4
give flights tuesday los angeles pittsburgh,atis_flight,4
need reverse flight pittsburgh denver please,atis_flight,4
looking get one air fare baltimore san francisco leaving august twenty seventh,atis_airfare,2
could give flight pittsburgh philadelphia,atis_flight,4
ground san francisco,atis_ground_service,6
would like see daily flights baltimore philadelphia,atis_flight,4
northwest united airlines flights stopovers denver,atis_flight,4
difference fare code q fare code b,atis_abbreviation,0
list nonstop flights san francisco oakland depart afternoon,atis_flight,4
flights phoenix milwaukee,atis_flight,4
give flights miami chicago american airlines,atis_flight,4
please list morning flights philadelphia toronto,atis_flight,4
many fare codes belong economy class,atis_quantity,7
flight american airlines going boston san francisco june twenty eighth,atis_flight,4
want fly atlanta philadelphia,atis_flight,4
early morning flights cincinnati tampa,atis_flight,4
april eighth would like book flight charlotte baltimore,atis_flight,4
afternoon flights available denver dallas fort worth,atis_flight,4
please list flights new york miami tuesday,atis_flight,4
latest flight philadelphia boston,atis_flight,4
list flights boston atlanta pm wednesday,atis_flight,4
list nonstop flights baltimore washington oakland arrive pm,atis_flight,4
earliest flight leaving boston going atlanta,atis_flight,4
kinds planes used midway airlines,atis_aircraft,1
need fly boston denver monday,atis_flight,4
would like information flights oakland california dallas leaving sunday morning,atis_flight,4
flights leave boston pittsburgh morning,atis_flight,4
continental flights boston san francisco stop denver,atis_flight,4
like see economy fares baltimore philadelphia,atis_airfare,2
nonstop flights boston washington arrive pm,atis_flight,4
ground transportation denver,atis_ground_service,6
please show flights boston denver stopover philadelphia,atis_flight,4
fare delta flight dallas san francisco,atis_airfare,2
like see flights baltimore philadelphia,atis_flight,4
flights go newark boston pm,atis_flight,4
flights boston dallas,atis_flight,4
flight atlanta charlotte north carolina next monday,atis_flight,4
san francisco denver,atis_flight,4
flights go atlanta washington dc thursday,atis_flight,4
please arrange flight denver san francisco us air,atis_flight,4
show flights dallas atlanta tuesday,atis_flight,4
least expensive airfare boston baltimore,atis_airfare,2
need flight pittsburgh denver,atis_flight,4
first class fare baltimore dallas,atis_airfare,2
airline code dl stand,atis_airline,3
show earliest flight cleveland memphis,atis_flight,4
flights pittsburgh boston wednesday next week morning,atis_flight,4
flights pittsburgh philadelphia arrive next tuesday,atis_flight,4
please list flights kansas city denver,atis_flight,4
please list shortest one stop flight ontario california orlando florida,atis_flight,4
like find nonstop flight boston atlanta leaves sometime afternoon arrives atlanta evening,atis_flight,4
show flights boston baltimore,atis_flight,4
show flights pittsburgh oakland,atis_flight,4
need late flight wednesday oakland salt lake city,atis_flight,4
