text,intent,encoded_intent
want fly boston arrive denver morning,atis_flight,4
flights available pittsburgh baltimore thursday morning,atis_flight,4
arrival time san francisco flight leaving washington,atis_flight_time,5
cheapest airfare tacoma orlando,atis_airfare,2
round trip fares pittsburgh philadelphia dollars,atis_airfare,2
need flight tomorrow columbus minneapolis,atis_flight,4
kind aircraft used flight cleveland dallas,atis_aircraft,1
show flights pittsburgh los angeles thursday,atis_flight,4
flights boston washington,atis_flight,4
kind ground transportation available denver,atis_ground_service,6
show flights dallas san francisco,atis_flight,4
show flights san diego newark way houston,atis_flight,4
cheapest flight boston bwi,atis_flight,4
flights baltimore pm,atis_flight,4
show first class fares boston denver,atis_airfare,2
show ground transportation denver,atis_ground_service,6
flights denver pittsburgh leaving pm pm,atis_flight,4
need information flights tuesday leaving baltimore dallas dallas boston boston baltimore,atis_flight,4
please give flights boston pittsburgh thursday next week,atis_flight,4
would like fly denver pittsburgh united airlines,atis_flight,4
show flights san diego newark,atis_flight,4
please list first class flights united denver baltimore,atis_flight,4
kinds planes used american airlines,atis_aircraft,1
like information ticket denver pittsburgh atlanta,atis_airfare,2
like book flight atlanta denver,atis_flight,4
airline serves denver pittsburgh atlanta,atis_airline,3
show flights boston pittsburgh wednesday next week leave boston pm,atis_flight,4
atlanta ground transportation,atis_ground_service,6
also need service dallas boston arriving noon,atis_flight,4
show cheapest round trip fare baltimore dallas,atis_airfare,2
show flights new york milwaukee northwest airlines departing,atis_flight,4
flights new york miami,atis_flight,4
please find flight delta philadelphia san francisco give flight numbers,atis_flight,4
need flight dallas san francisco,atis_flight,4
fares flights pittsburgh philadelphia,atis_airfare,2
show airlines first class flights,atis_airline,3
flights louis burbank sunday evening,atis_flight,4
like arrange flight pittsburgh atlanta,atis_flight,4
show flights baltimore san francisco pm pm friday,atis_flight,4
would like list round trip flights indianapolis orlando florida twenty seventh twenty eighth december,atis_flight,4
airline arrivals atlanta,atis_airline,3
airlines fly new york milwaukee los angeles,atis_airline,3
pittsburgh denver,atis_flight,4
airlines serve atlanta,atis_airline,3
show information ground transportation dallas,atis_ground_service,6
fare code h,atis_abbreviation,0
show flights boston dallas fort worth direct connecting arrive noon,atis_flight,4
need flight charlotte newark leaving today evening,atis_flight,4
times planes leaving san francisco going pittsburgh july seventh,atis_flight_time,5
flights newark cleveland,atis_flight,4
flights go boston pittsburgh next tuesday,atis_flight,4
us air flights atlanta denver,atis_flight,4
booking class c,atis_abbreviation,0
like know shortest trip boston san francisco,atis_flight,4
would like see information flights san francisco leaving pm pittsburgh monday,atis_flight,4
least expensive flight denver atlanta,atis_flight,4
need know information flights leaving dallas tuesday evening returning atlanta,atis_flight,4
flight goes denver baltimore first class united airlines arriving may seventh,atis_flight,4
could please tell airlines fly toronto san diego,atis_airline,3
flights burbank tacoma washington,atis_flight,4
ground transportation philadelphia airport city proper,atis_ground_service,6
airlines first class flights today,atis_airline,3
find latest flight san francisco atlanta serves meal,atis_flight,4
would like make reservation flight denver philadelphia coming sunday,atis_flight,4
show flights boston denver wednesday,atis_flight,4
show flights boston baltimore,atis_flight,4
fare code q mean,atis_abbreviation,0
please give flights san francisco washington dc,atis_flight,4
need information denver pittsburgh,atis_flight,4
seattle salt lake city,atis_flight,4
earliest flight boston bwi serves snack,atis_flight,4
types aircraft delta fly,atis_aircraft,1
cost round trip flight pittsburgh atlanta beginning april twenty fifth returning may sixth,atis_airfare,2
give flights leaving denver august ninth coming back boston,atis_flight,4
list flights fly general mitchell international,atis_flight,4
flights fly denver san francisco monday tuesday wednesday thursday friday,atis_flight,4
list flights indianapolis seattle,atis_flight,4
flight meal oakland philadelphia saturday,atis_flight,4
show flights twa atlanta morning,atis_flight,4
want find first flight baltimore boston serves meal,atis_flight,4
airlines airline arrivals atlanta,atis_airline,3
display flights baltimore boston july twenty ninth,atis_flight,4
want travel atlanta baltimore early morning first flight,atis_flight,4
need flight san jose houston leaving sunday fourth,atis_flight,4
flights available pm san francisco boston,atis_flight,4
flights depart baltimore friday arrive san francisco pm,atis_flight,4
show flights boston san francisco,atis_flight,4
list delta airlines flights boston philadelphia,atis_flight,4
show fares dallas san francisco,atis_airfare,2
nonstop flights boston washington arrive pm,atis_flight,4
ground transportation san jose,atis_ground_service,6
please tell many nonstop flights boston atlanta,atis_quantity,7
earliest flight san francisco atlanta delta meal served,atis_flight,4
canadian airlines international fly,atis_flight,4
flights denver pittsburgh arrive morning,atis_flight,4
find earliest flight boston atlanta,atis_flight,4
list nonstop flights houston dallas arrive midnight,atis_flight,4
show flights boston san francisco stop atlanta,atis_flight,4
show flights san francisco philadelphia stopping dallas,atis_flight,4
show flights baltimore dallas,atis_flight,4
show list ground transportation denver,atis_ground_service,6
like flight columbus phoenix stopping cincinnati serving dinner available,atis_flight,4
also show flights san francisco pittsburgh tuesday,atis_flight,4
show flights dallas oakland,atis_flight,4
give cheapest flight charlotte long beach,atis_flight,4
show flights san francisco pittsburgh,atis_flight,4
find flight united boston san francisco stopover denver,atis_flight,4
show last flight love field,atis_flight,4
flights go newark boston pm,atis_flight,4
flights boston dallas,atis_flight,4
earliest flight departing san francisco arriving boston november ninth,atis_flight,4
earliest flight flying pittsburgh atlanta july fifth,atis_flight,4
please list available flights next saturday philadelphia dallas,atis_flight,4
flights leave pittsburgh arrive los angeles pm thursday,atis_flight,4
transportation time airport boston,atis_ground_service,6
airline smallest plane leaving pittsburgh arriving baltimore july fourth,atis_airline,3
nonstop flights america west southwest air kansas city burbank saturday may twenty two,atis_flight,4
classes service american airlines,atis_flight,4
would like find flights friday june eleventh petersburg milwaukee milwaukee tacoma thank,atis_flight,4
flights boston washington dc november tenth,atis_flight,4
flights denver san francisco,atis_flight,4
flight san francisco atlanta type aircraft used,atis_aircraft,1
flight one way fare dollars denver pittsburgh,atis_flight,4
flights leave baltimore boston friday,atis_flight,4
okay need get flight houston seattle,atis_flight,4
please list flights denver boston,atis_flight,4
find flights nonstop boston dallas leave afternoon,atis_flight,4
would like information flights leaving boston atlanta,atis_flight,4
show latest nonstop flight denver washington dc,atis_flight,4
flights dallas baltimore,atis_flight,4
would like nonstop flight new york las vegas march second,atis_flight,4
want go denver oakland,atis_flight,4
show night fares philadelphia san francisco,atis_airfare,2
kinds ground transportation available dallas fort worth,atis_ground_service,6
show economy class one way fares flights oakland dallas december sixteenth,atis_airfare,2
fare code qw,atis_abbreviation,0
like flight july ninth orlando kansas city afternoon,atis_flight,4
coach fares charlotte la wednesday night,atis_airfare,2
ground transportation available denver,atis_ground_service,6
show flights philadelphia oakland friday,atis_flight,4
would like know flights available boston denver arriving denver wednesday morning,atis_flight,4
would like fly cheapest rate available pittsburgh atlanta wednesday morning,atis_flight,4
list flight philadelphia san francisco american airlines,atis_flight,4
flights memphis las vegas sunday,atis_flight,4
first flight atlanta boston thursday september fifth leaves,atis_flight,4
first class fare united flight denver boston,atis_airfare,2
flight philadelphia dallas arriving pm saturday,atis_flight,4
list flights tomorrow san diego phoenix,atis_flight,4
show flights san francisco washington dc area,atis_flight,4
sure want go philadelphia dallas,atis_flight,4
show united airlines flights leaving dallas,atis_flight,4
list flights phoenix las vegas,atis_flight,4
list flights baltimore philadelphia,atis_flight,4
round trip flights minneapolis san diego coach economy fare,atis_flight,4
want fly boston denver want stopovers like fly afternoon,atis_flight,4
flights denver baltimore pm,atis_flight,4
show flights denver atlanta,atis_flight,4
flights delta boston dallas,atis_flight,4
kind ground transportation offer seattle,atis_ground_service,6
leaving washington going san francisco latest flight,atis_flight,4
show flights available atlanta baltimore leaving atlanta morning,atis_flight,4
round trip fares new york san jose,atis_airfare,2
flights serviced american airlines,atis_flight,4
get pittsburgh airport downtown pittsburgh,atis_flight,4
midwest express serve charlotte,atis_flight,4
flights houston milwaukee friday evening american airlines,atis_flight,4
earliest flight going san francisco dallas monday august nineteenth,atis_flight,4
flights atlanta louis tuesday arriving around pm,atis_flight,4
need flight kansas city chicago leaves wednesday arrives chicago around pm,atis_flight,4
would like information flights pittsburgh san francisco leaving thursday evening,atis_flight,4
need cheap flight baltimore san francisco,atis_flight,4
cost first class ticket baltimore dallas,atis_airfare,2
economy thrift fare boston washington,atis_airfare,2
list nonstop flights early tuesday morning dallas atlanta,atis_flight,4
earliest flight leaves philadelphia dallas,atis_flight,4
flights dallas fort worth boston leaving,atis_flight,4
show flights baltimore pm,atis_flight,4
need return flight philadelphia boston,atis_flight,4
united airlines flights stopping denver noon,atis_flight,4
show car rentals baltimore,atis_ground_service,6
flights go newark boston morning,atis_flight,4
shortest evening flight tampa cincinnati,atis_flight,4
much time take go airport downtown ground transportation dallas,atis_ground_service,6
flights boston pittsburgh,atis_flight,4
like fly continental airlines boston philadelphia,atis_flight,4
would like book flight continental airlines chicago seattle june first,atis_flight,4
flights pittsburgh dallas round trip pm less,atis_flight,4
show flights sunday going san francisco boston nonstop first class leaving noon,atis_flight,4
las vegas phoenix,atis_flight,4
show flights pittsburgh atlanta monday afternoon,atis_flight,4
show flight smallest seating capacity leaves pittsburgh arrives baltimore june fourteenth,atis_flight,4
show flights boston denver july thirty first,atis_flight,4
flights noon june fifteenth long beach columbus,atis_flight,4
list daily flights boston atlanta,atis_flight,4
flight san francisco atlanta leaves flight,atis_flight,4
united airlines give flight times boston dallas,atis_flight_time,5
ground transportation minneapolis,atis_ground_service,6
show airline abbreviations,atis_airline,3
many flights delta class service code f,atis_quantity,7
please list arriving departing flights general mitchell international,atis_flight,4
would like see flights denver philadelphia please,atis_flight,4
eastern airlines fly early morning logan bwi,atis_flight,4
flights leave phoenix american airlines,atis_flight,4
list airlines flights boston san francisco,atis_airline,3
flights nashville orlando daily,atis_flight,4
show first class flights pittsburgh san francisco friday,atis_flight,4
need earliest flight denver boston serves dinner,atis_flight,4
toronto atlanta afternoon,atis_flight,4
please list friday afternoon flights san jose dallas american airlines,atis_flight,4
ground transportation boston airport,atis_ground_service,6
show first flight pittsburgh atlanta wednesday,atis_flight,4
sorry wanted fly twa flight oakland boston stopover dallas fort worth twa,atis_flight,4
show flights san francisco la guardia nonstop,atis_flight,4
flights pittsburgh los angeles,atis_flight,4
kind ground transportation washington dc,atis_ground_service,6
least expensive flight available dallas fort worth san francisco,atis_flight,4
fare code f mean,atis_abbreviation,0
expensive way fly washington,atis_flight,4
flights houston milwaukee friday american airlines,atis_flight,4
schedule ground transportation airport philadelphia downtown,atis_ground_service,6
show list flights san francisco boston august thirtieth,atis_flight,4
show least expensive flight miami cleveland sunday noon,atis_flight,4
much cost go downtown logan airport,atis_airfare,2
flights newark tampa,atis_flight,4
want flight philadelphia dallas least one stop,atis_flight,4
show flights denver oakland arriving,atis_flight,4
fare san francisco dallas fort worth delta flight,atis_airfare,2
flights newark new jersey cleveland ohio,atis_flight,4
give flights denver baltimore,atis_flight,4
show flights denver san francisco,atis_flight,4
show flights denver washington dc thursday,atis_flight,4
please list thursday morning flights louis paul,atis_flight,4
flight pittsburgh san francisco morning august twenty seventh,atis_flight,4
flights boston atlanta,atis_flight,4
flights baltimore san francisco arrive pm san francisco,atis_flight,4
show flights pittsburgh san francisco thursday night friday,atis_flight,4
get first class flight american san francisco tuesday next week,atis_flight,4
ground transportation westchester county,atis_ground_service,6
flights atlanta baltimore,atis_flight,4
like fly dallas san francisco approximately pm,atis_flight,4
list fares us air flights boston philadelphia,atis_airfare,2
list flights phoenix detroit thursday june twenty fourth,atis_flight,4
flights miami indianapolis sunday,atis_flight,4
show flights memphis cleveland,atis_flight,4
give information flights san francisco pittsburgh san francisco monday,atis_flight,4
could find flight boston san francisco stops denver,atis_flight,4
flights cleveland miami,atis_flight,4
give flights pittsburgh los angeles thursday evening,atis_flight,4
please list flights leaving atlanta heading baltimore pm wednesday thursday,atis_flight,4
show flights seattle san francisco leave pm,atis_flight,4
show flights go tacoma miami,atis_flight,4
airline fly atlanta denver san francisco,atis_airline,3
flights denver pittsburgh stops atlanta,atis_flight,4
list flights arrive general mitchell international,atis_flight,4
fare code h,atis_abbreviation,0
flights salt lake city new york city arrive next saturday pm,atis_flight,4
flights nashville seattle,atis_flight,4
show fares seattle minneapolis,atis_airfare,2
need flight boston san francisco via dallas fort worth,atis_flight,4
like afternoon flight atlanta san francisco stopover denver arriving say mealtime,atis_flight,4
show expensive one way flight detroit westchester county,atis_flight,4
show flights baltimore philadelphia,atis_flight,4
denver washington dc monday november eleventh,atis_flight,4
please list flights boston denver serve meals,atis_flight,4
list aircraft types fly boston san francisco,atis_aircraft,1
fare code qw mean,atis_abbreviation,0
interested flight american airlines dallas washington,atis_flight,4
give flights pittsburgh baltimore,atis_flight,4
much round trip fare indianapolis seattle,atis_airfare,2
cheapest flight long beach memphis,atis_flight,4
airline provides business class flights,atis_airline,3
pittsburgh denver,atis_flight,4
airlines fly boston pittsburgh,atis_airline,3
list flights arriving atlanta baltimore noon august fourth,atis_flight,4
give flights american airline philadelphia dallas,atis_flight,4
need flight sunday miami las vegas would prefer morning flight,atis_flight,4
flights boston pittsburgh,atis_flight,4
flights go pittsburgh atlanta evening,atis_flight,4
show fares dallas san francisco,atis_airfare,2
give american airlines flights milwaukee phoenix saturday sunday,atis_flight,4
list flights leave baltimore denver pittsburgh arrive philadelphia,atis_flight,4
show flights baltimore oakland,atis_flight,4
show earliest flight denver las vegas,atis_flight,4
show flights milwaukee orlando wednesday night,atis_flight,4
may listing flights milwaukee tacoma washington departing evening,atis_flight,4
morning flights oakland denver,atis_flight,4
like flight washington stops denver goes san francisco,atis_flight,4
show flights pittsburgh baltimore tomorrow,atis_flight,4
one way flights boston philadelphia,atis_flight,4
flights go san francisco boston,atis_flight,4
flights san francisco philadelphia daily economy class,atis_flight,4
first flights pittsburgh atlanta thursday,atis_flight,4
show flights baltimore atlanta,atis_flight,4
tell flights toronto salt lake city leaving pm,atis_flight,4
show flights indianapolis orlando round trip fares less,atis_flight,4
need flight boston pittsburgh leaves early morning,atis_flight,4
first flight atlanta baltimore serves lunch,atis_flight,4
show flights pittsburgh baltimore,atis_flight,4
flights denver philadelphia,atis_flight,4
oakland philadelphia saturday,atis_flight,4
give earliest flight tomorrow united airlines petersburg milwaukee,atis_flight,4
show flights monday philadelphia boston,atis_flight,4
show flights leaving baltimore,atis_flight,4
show flights philadelphia boston,atis_flight,4
plane boston washington,atis_aircraft,1
need go boston atlanta back day find earliest flight boston,atis_flight,4
flights boston pittsburgh august tenth,atis_flight,4
schedule flights boston san francisco august first,atis_flight_time,5
show one way flights milwaukee orlando wednesday,atis_flight,4
show flights pittsburgh baltimore tomorrow serve meal,atis_flight,4
give flights american airlines milwaukee phoenix,atis_flight,4
show flights pittsburgh san francisco,atis_flight,4
wish fly boston washington please find airline,atis_flight,4
please list flights dallas fort worth dc baltimore july twenty third,atis_flight,4
flights memphis tacoma also stop los angeles,atis_flight,4
show flights tuesday morning charlotte baltimore,atis_flight,4
need first class tickets dallas fort worth san francisco,atis_airfare,2
flights philadelphia dallas stop atlanta,atis_flight,4
flights baltimore,atis_flight,4
mco stand,atis_abbreviation,0
least expensive way fly philadelphia san francisco,atis_flight,4
list nonstop flights los angeles pittsburgh pm tuesday,atis_flight,4
many booking classes,atis_quantity,7
give continental flights chicago seattle friday,atis_flight,4
united airlines flights baltimore denver august twelfth,atis_flight,4
show flights next tuesday philadelphia san francisco,atis_flight,4
find flight american airlines boston san francisco makes stopover denver,atis_flight,4
show fares flights round trip pittsburgh oakland,atis_airfare,2
difference fare code q fare code f,atis_abbreviation,0
flights cincinnati salt lake city,atis_flight,4
ground transportation denver,atis_ground_service,6
show flights denver washington dc wednesdays,atis_flight,4
find flight denver oakland flight afternoon arrive close pm flight nonstop,atis_flight,4
show flights atlanta washington prices,atis_flight,4
flights new york miami,atis_flight,4
please list monday morning flights kansas city atlanta,atis_flight,4
list american airlines flights phoenix milwaukee arrive wednesday pm,atis_flight,4
round trip tickets cleveland miami us air arrive pm,atis_airfare,2
like go boston denver saturday night,atis_flight,4
show northwest flights detroit petersburg,atis_flight,4
available ground transportation airport denver downtown,atis_ground_service,6
may four atlanta denver delta flight,atis_flight,4
show flights indianapolis,atis_flight,4
airlines flights philadelphia pittsburgh,atis_airline,3
flights denver baltimore washington dc,atis_flight,4
list number flights leaving boston dallas fort worth morning,atis_quantity,7
delta flights leaving atlanta,atis_flight,4
list round trip flights orlando kansas city minneapolis,atis_flight,4
would like find flight kansas city salt lake city delta arriving evening could please tell aircraft flight number thank,atis_flight,4
would like flight washington boston leaving august twentieth,atis_flight,4
much flight washington boston,atis_airfare,2
show flights orlando san diego boeing,atis_flight,4
flights sunday seattle minneapolis,atis_flight,4
show flights pittsburgh atlanta,atis_flight,4
united airlines flight flies across continent leaves boston goes dallas makes stopover philadelphia,atis_flight,4
list daily flights united airline denver baltimore first class service,atis_flight,4
show flights pittsburgh atlanta monday morning,atis_flight,4
flights phoenix sfo,atis_flight,4
want travel washington dc philadelphia tuesday morning,atis_flight,4
fare going atlanta boston one way november seventh,atis_airfare,2
flight american airlines boston denver,atis_flight,4
flights available san francisco pittsburgh thursday evening,atis_flight,4
afternoon flight leaving afternoon going boston san francisco stopover dallas,atis_flight,4
show flights pittsburgh san francisco monday,atis_flight,4
show list flights american airlines boston dc july twenty second,atis_flight,4
like flights philadelphia pittsburgh leaving pm,atis_flight,4
economy flights available dallas baltimore december seventeenth,atis_flight,4
please show flights san francisco dallas,atis_flight,4
please show flights indianapolis san diego tomorrow,atis_flight,4
flight code us mean,atis_flight,4
would like flight denver pittsburgh,atis_flight,4
flight schedule pittsburgh baltimore,atis_flight_time,5
looking flight dc minnesota,atis_flight,4
many us air flights leave washington,atis_quantity,7
show times flights san francisco atlanta,atis_flight_time,5
flights wednesday evening thursday morning denver sfo,atis_flight,4
many flights go dallas baltimore july nineteenth,atis_quantity,7
could show flights oakland salt lake city,atis_flight,4
find flight boston san francisco layover denver united,atis_flight,4
flights available boston washington arriving washington,atis_flight,4
show airlines toronto denver,atis_airline,3
flights pittsburgh atlanta,atis_flight,4
show flights denver westchester county,atis_flight,4
need information flight denver atlanta,atis_flight,4
cheapest flight boston atlanta,atis_flight,4
cheapest flight atlanta pittsburgh one way,atis_flight,4
show overnight flights washington dc san francisco list fares,atis_flight,4
round trip flights new york miami,atis_flight,4
show one way flight detroit westchester county highest fare,atis_flight,4
flights newark chicago continental,atis_flight,4
trying make connection denver san francisco delta airline fly two,atis_flight,4
latest us air flight leaving philadelphia returning boston,atis_flight,4
flights us air san francisco pittsburgh tuesday,atis_flight,4
fly boston baltimore washington,atis_flight,4
mco,atis_abbreviation,0
flights las vegas phoenix,atis_flight,4
would like leave around morning,atis_flight,4
show fares baltimore philadelphia,atis_airfare,2
flights memphis seattle,atis_flight,4
please show flights pittsburgh atlanta wednesday morning serving breakfast,atis_flight,4
flights atlanta august second,atis_flight,4
american airlines fly atlanta philadelphia,atis_flight,4
yes like flight long beach louis way dallas,atis_flight,4
like know flights denver philadelphia,atis_flight,4
cheapest one way flights atlanta denver,atis_flight,4
first flight noon washington denver,atis_flight,4
many delta flights leave washington,atis_quantity,7
list united flights flight oakland boston,atis_flight,4
philadelphia toronto,atis_flight,4
interested flight american airlines dallas washington,atis_flight,4
airplane types fly pittsburgh baltimore,atis_aircraft,1
yn code,atis_abbreviation,0
would like earliest morning flight atlanta philadelphia wednesday morning,atis_flight,4
may listing flights long beach columbus ohio tuesday,atis_flight,4
flights leave phoenix nashville american airlines,atis_flight,4
show round trips new york miami leaving tuesday,atis_flight,4
list nonstop flights sunday tampa charlotte,atis_flight,4
list flights burbank denver,atis_flight,4
round trip fares flights denver philadelphia arriving continental,atis_airfare,2
like see flights baltimore atlanta,atis_flight,4
please show flights las vegas detroit twenty eighth,atis_flight,4
ord,atis_abbreviation,0
type ground transportation available airport downtown san francisco,atis_ground_service,6
american flight boston oakland nonstop flight,atis_flight,4
give flights washington dc philadelphia december second,atis_flight,4
show connecting flights pittsburgh oakland,atis_flight,4
list daily flights boston oakland using twa,atis_flight,4
would like least expensive airfare flight sunday pittsburgh san francisco,atis_airfare,2
need flight san diego indianapolis leaving afternoon tuesday,atis_flight,4
give evening flight wednesday washington atlanta,atis_flight,4
would like book flight los angeles pittsburgh june first,atis_flight,4
flights atlanta washington,atis_flight,4
show flights direct boston san francisco oakland arrive local time,atis_flight,4
