text,intent,encoded_intent
flights ontario orlando,atis_flight,4
wednesday baltimore newark,atis_flight,4
round trip fare baltimore philadelphia less dollars,atis_airfare,2
okay monday may thirty first like go san diego phoenix early morning,atis_flight,4
list flights denver san francisco wednesday afternoon,atis_flight,4
cheapest flight pittsburgh atlanta,atis_flight,4
northwest fly denver,atis_flight,4
show flights new york city las vegas,atis_flight,4
would like fly denver boston wednesday twenty first,atis_flight,4
like fly boston baltimore,atis_flight,4
oakland san francisco please breakfast flight,atis_flight,4
show flights boston denver serve lunch,atis_flight,4
want go boston oakland,atis_flight,4
cost flights denver san francisco,atis_airfare,2
flights pittsburgh philadelphia next tuesday arriving near,atis_flight,4
hi need go newark nashville american airlines leaving around pm,atis_flight,4
show evening flights atlanta washington wednesdays,atis_flight,4
show nonstop flights miami new york coach class fares,atis_flight,4
information flight atlanta pittsburgh,atis_flight,4
show flights montreal nashville,atis_flight,4
please give flights available baltimore philadelphia,atis_flight,4
show flights dallas baltimore fare dollars,atis_flight,4
show flights pittsburgh philadelphia,atis_flight,4
requesting flight information flight san francisco pittsburgh friday,atis_flight,4
delta flights san francisco please,atis_flight,4
please list delta flights kansas city salt lake city,atis_flight,4
flights available dallas atlanta one way economy fares,atis_flight,4
get bwi washington,atis_flight,4
like list flights san francisco pittsburgh sunday please,atis_flight,4
direct flight denver pittsburgh morning august thirty first nonstop,atis_flight,4
like buy coach class ticket denver atlanta stopover pittsburgh,atis_airfare,2
show flights philadelphia dallas arrive dallas pm saturday,atis_flight,4
show flights san francisco denver thursday,atis_flight,4
please list friday night flights paul kansas city,atis_flight,4
flights boston baltimore,atis_flight,4
let see much would direct flight atlanta denver may seventh,atis_airfare,2
flights dallas san francisco,atis_flight,4
show flights chicago kansas city thursday june seventeenth arriving kansas city around evening,atis_flight,4
list list flights oakland denver,atis_flight,4
northwest flights leave denver noon,atis_flight,4
airlines fly bwi dallas fort worth,atis_airline,3
show saturday flights pittsburgh baltimore,atis_flight,4
american airlines denver milwaukee,atis_flight,4
need flight information thursday leaving pittsburgh arriving baltimore morning,atis_flight,4
early morning direct flight philadelphia pittsburgh,atis_flight,4
flight washington dc salt lake city,atis_flight,4
ground transportation available san francisco,atis_ground_service,6
would like flight dallas philadelphia,atis_flight,4
flights denver oakland,atis_flight,4
flights tuesday october first atlanta baltimore,atis_flight,4
like see flights baltimore atlanta arrive noon like see flights denver atlanta arrive noon,atis_flight,4
show flights philadelphia denver,atis_flight,4
show flights boston pittsburgh hours wednesday,atis_flight,4
show round trip tickets new york miami,atis_airfare,2
schedule ground transportation washington airport downtown,atis_flight_time,5
want fly philadelphia dallas san francisco monday july eighth,atis_flight,4
list lowest cost flight dallas baltimore serves meal,atis_flight,4
show flights oakland denver,atis_flight,4
show flights denver baltimore,atis_flight,4
give round trip coach fare baltimore dallas,atis_airfare,2
show latest flight love field,atis_flight,4
flights available baltimore boston august twelfth,atis_flight,4
ewr,atis_abbreviation,0
show flights san francisco pittsburgh friday,atis_flight,4
flights tacoma san jose wednesday nineteenth,atis_flight,4
need ground transportation tuesday july sixth wednesday july seventh san diego,atis_ground_service,6
explain restriction ap,atis_abbreviation,0
would like fly denver dollars please show airfares pittsburgh denver,atis_flight,4
round trip fares baltimore philadelphia less dollars round trip fares denver philadelphia less dollars round trip fares pittsburgh philadelphia less dollars,atis_airfare,2
please list flights washington dc atlanta,atis_flight,4
find travel arrangements round trip flight dallas pittsburgh,atis_flight,4
list flights montreal washington lowest one way fares leaves saturday,atis_flight,4
prices flights atlanta dallas morning,atis_airfare,2
like information flights san francisco pittsburgh tuesday,atis_flight,4
tell ground transportation dallas airport downtown dallas,atis_ground_service,6
like go paul kansas city friday meal,atis_flight,4
many flights eastern airlines boston atlanta,atis_quantity,7
cost fly boston san francisco united airlines flight,atis_airfare,2
want flight san diego indianapolis leaves tuesday afternoon,atis_flight,4
morning flights pittsburgh atlanta wednesday,atis_flight,4
flights leave chicago seattle saturday,atis_flight,4
list flights going boston atlanta thursday,atis_flight,4
much first class round trip atlanta san francisco,atis_airfare,2
want go boston atlanta monday,atis_flight,4
flights boston san diego,atis_flight,4
show flights atlanta baltimore,atis_flight,4
cheapest one way flight oakland washington dc,atis_flight,4
show flights love field,atis_flight,4
need nonstop flight san diego phoenix,atis_flight,4
flights atlanta oakland thursday,atis_flight,4
flights kansas city chicago arrive chicago pm next wednesday,atis_flight,4
would like book flight chicago seattle june first continental airlines,atis_flight,4
flights las vegas montreal saturday,atis_flight,4
list flights continental denver chicago sunday depart pm,atis_flight,4
flights leave atlanta afternoon arrive san francisco,atis_flight,4
show flights denver pittsburgh serve meal day tomorrow,atis_flight,4
ground transportation atlanta airport downtown atlanta,atis_ground_service,6
interested booking early morning flight dallas houston returning late evening,atis_flight,4
please give fares denver philadelphia,atis_airfare,2
need flights leave denver pm next monday fly pittsburgh,atis_flight,4
list flights arriving general mitchell international,atis_flight,4
information ground transportation denver,atis_ground_service,6
many flights come denver baltimore july nineteenth,atis_quantity,7
list nonstop flights los angeles pittsburgh arrive monday pm,atis_flight,4
pittsburgh atlanta wednesday,atis_flight,4
us air leaving boston arrival time baltimore,atis_flight,4
airline dl,atis_airline,3
fare code f fn mean,atis_abbreviation,0
flight boston baltimore,atis_flight,4
airlines fly boston san francisco,atis_airline,3
flight charlotte atlanta next tuesday,atis_flight,4
show flights arriving around noon washington dc denver,atis_flight,4
need take ten people phoenix san diego please give flights week days,atis_flight,4
please list flight available leaving oakland california tuesday arriving philadelphia wednesday,atis_flight,4
show flights new york city las vegas,atis_flight,4
united airlines flights go denver,atis_flight,4
ground transportation available washington,atis_ground_service,6
round trip flights atlanta denver qualify fare code qx,atis_flight,4
nonstop flights atlanta washington leave atlanta pm,atis_flight,4
flights pittsburgh baltimore thursday arrival,atis_flight,4
want arrive detroit around pm leaving chicago,atis_flight,4
fare november seventh going one way dallas san francisco,atis_airfare,2
list round trip fares pittsburgh washington dc,atis_airfare,2
please show flights dallas denver,atis_flight,4
ground transportation atlanta,atis_ground_service,6
show flights san francisco pittsburgh,atis_flight,4
flight oakland boston stopover dallas fort worth twa,atis_flight,4
ground transportation pittsburgh airport downtown pittsburgh,atis_ground_service,6
flight around pm charlotte minneapolis,atis_flight,4
first flight goes atlanta baltimore serves breakfast,atis_flight,4
latest flight boston denver serves meal,atis_flight,4
flights jfk la guardia cleveland,atis_flight,4
code mean,atis_abbreviation,0
flight ua denver philadelphia meal,atis_flight,4
list flights atlanta boston wednesday afternoon,atis_flight,4
flight information january twenty third denver san francisco,atis_flight,4
delta flight san francisco denver august thirtieth early morning,atis_flight,4
need information flights leaving baltimore arriving atlanta,atis_flight,4
show flights philadelphia dallas,atis_flight,4
fare code mean,atis_abbreviation,0
lowest fare denver pittsburgh,atis_airfare,2
round trip flights salt lake city cincinnati nonstop flights possible,atis_flight,4
like twa flight atlanta pittsburgh stopover fort worth dallas please,atis_flight,4
time twa depart boston go san francisco,atis_flight_time,5
give earliest flight tomorrow petersburg milwaukee airline twa,atis_flight,4
abbreviation,atis_abbreviation,0
newark cleveland,atis_flight,4
show flights pittsburgh philadelphia arrive wednesday,atis_flight,4
list flights dallas san francisco american airlines,atis_flight,4
time earliest flight goes atlanta denver leave,atis_flight_time,5
list types aircraft fly boston san francisco,atis_aircraft,1
show flights boston fort worth morning july tenth,atis_flight,4
like cheapest one way fare boston san francisco,atis_airfare,2
show flights leave pittsburgh tomorrow arrive baltimore pm,atis_flight,4
ground transportation available city philadelphia,atis_ground_service,6
would like make one way flight boston atlanta,atis_flight,4
flights united airlines dallas san francisco,atis_flight,4
ua,atis_abbreviation,0
would like arrange flight denver pittsburgh,atis_flight,4
airlines fly petersburg milwaukee milwaukee tacoma,atis_airline,3
much cost fly boston baltimore saturday,atis_airfare,2
monday like travel las vegas detroit michigan,atis_flight,4
show flights kansas city chicago june sixteenth arriving around evening,atis_flight,4
boston denver monday,atis_flight,4
tell twa flight,atis_flight,4
smallest aircraft available flying pittsburgh baltimore arriving may seventh,atis_aircraft,1
need flight denver philadelphia,atis_flight,4
price one way fare boston denver continental airlines,atis_airfare,2
flights prices la charlotte monday morning,atis_flight,4
show flights boston pittsburgh leaving wednesdays thursdays,atis_flight,4
show fares flights denver oakland,atis_airfare,2
tell latest evening flight atlanta denver july seventh,atis_flight,4
tell ground transportation san francisco,atis_ground_service,6
would like know flights denver pittsburgh leaving monday,atis_flight,4
list flights denver pittsburgh,atis_flight,4
flights available pittsburgh baltimore july twenty fifth,atis_flight,4
show evening flights baltimore,atis_flight,4
flights chicago kansas city,atis_flight,4
like fly denver pittsburgh stop atlanta,atis_flight,4
afternoon flights atlanta baltimore,atis_flight,4
show flights san francisco denver weekdays,atis_flight,4
show flights dallas baltimore first class,atis_flight,4
delta fly atlanta san francisco,atis_flight,4
show ground transportation denver,atis_ground_service,6
show list us air flights boston dc,atis_flight,4
display fare codes,atis_airfare,2
flights stop atlanta noon,atis_flight,4
cheapest flight memphis miami,atis_flight,4
show flights denver baltimore,atis_flight,4
give cheapest round trip flight dallas baltimore,atis_flight,4
different classes airline offers,atis_flight,4
like see flights fares denver atlanta,atis_flight,4
eastern airlines fly boston washington,atis_flight,4
show flights philadelphia san francisco wednesdays,atis_flight,4
like book flight american airlines boston san francisco one stop pittsburgh,atis_flight,4
kind ground transportation available atlanta,atis_ground_service,6
show flights boston philadelphia monday,atis_flight,4
cheapest one way fare boston washington,atis_airfare,2
find cheapest flight boston washington,atis_flight,4
classes service twa,atis_flight,4
kind aircraft flying boston san francisco august twenty seventh,atis_aircraft,1
fine give information ground transportation washington dc downtown,atis_ground_service,6
nonstop flight denver san francisco,atis_flight,4
want direct flight oakland boston leaves wednesday,atis_flight,4
flights available boston denver today,atis_flight,4
san francisco denver,atis_flight,4
show flights philadelphia san francisco one stop dallas,atis_flight,4
display flights toronto san diego us air stopping denver,atis_flight,4
much first class ticket boston san francisco,atis_airfare,2
oakland philadelphia,atis_flight,4
list round trip flights boston oakland using twa,atis_flight,4
show flights san francisco boston,atis_flight,4
show us air flights pittsburgh afternoon,atis_flight,4
would like evening schedule flights san francisco washington,atis_flight_time,5
fares dallas san francisco flight dl,atis_airfare,2
kind ground transportation denver,atis_ground_service,6
delta flights available fly philadelphia boston,atis_flight,4
show list flights fly washington san francisco via dallas,atis_flight,4
first flight boston dallas,atis_flight,4
eastern flies atlanta denver type aircraft use pm,atis_flight,4
show flights milwaukee orlando thursday noon,atis_flight,4
united flight miami washington dc wednesday,atis_flight,4
want flight san francisco denver leaving san francisco afternoon arriving denver around afternoon,atis_flight,4
flights boston washington october fifteenth,atis_flight,4
flights denver pittsburgh wednesday,atis_flight,4
please list flights denver noon united airlines northwest airlines,atis_flight,4
flights available denver philadelphia wednesday,atis_flight,4
flights available san francisco pittsburgh monday morning,atis_flight,4
show flights baltimore philadelphia,atis_flight,4
fare thrift economy flight boston san francisco,atis_airfare,2
get airport pittsburgh downtown,atis_flight,4
possible fly baltimore san francisco,atis_flight,4
find travel arrangements round trip flight boston pittsburgh,atis_flight,4
ground transportation city dallas,atis_ground_service,6
phoenix denver monday,atis_flight,4
latest flight salt lake city petersburg,atis_flight,4
like information flights denver san francisco,atis_flight,4
may see nonstop flights petersburg charlotte,atis_flight,4
baltimore san francisco,atis_flight,4
show airlines fly denver san francisco,atis_airline,3
round trip fares denver philadelphia less dollars,atis_airfare,2
would like flight philadelphia dallas,atis_flight,4
need fly boston baltimore please give times flights morning,atis_flight,4
show flights arriving love field airports,atis_flight,4
could tell flights philadelphia dallas flights leave philadelphia morning,atis_flight,4
airlines fly toronto san diego stopover denver,atis_airline,3
november twenty third flights available boston denver american airlines,atis_flight,4
show flights pittsburgh dallas,atis_flight,4
flights houston milwaukee friday american airlines,atis_flight,4
want early morning flight philadelphia pittsburgh tuesday morning,atis_flight,4
cheapest round trip fare atlanta pittsburgh,atis_airfare,2
first flight boston san francisco saturday,atis_flight,4
show business class fares us air boston toronto,atis_airfare,2
show round trip fares new york miami,atis_airfare,2
first class fare boston dallas,atis_airfare,2
show flights san francisco washington dc,atis_flight,4
would like fly united airlines washington dc denver colorado,atis_flight,4
flights atlanta baltimore,atis_flight,4
like flight tomorrow columbus houston stopover nashville,atis_flight,4
like book cheapest flight atlanta denver august first,atis_flight,4
show flights boston june twentieth business class,atis_flight,4
show prices flights baltimore dallas,atis_airfare,2
ground transportation available charlotte,atis_ground_service,6
breakfast flight denver san francisco please,atis_flight,4
many stops flights boston san francisco depart noon,atis_quantity,7
would like flight atlanta denver,atis_flight,4
continental flights dallas boston,atis_flight,4
pittsburgh ground transportation available,atis_ground_service,6
next sunday flights miami cleveland hours,atis_flight,4
show flights baltimore dallas,atis_flight,4
fare code qx mean,atis_abbreviation,0
show flights miami new york leaving sunday first class,atis_flight,4
would like book flight august twenty seventh us air baltimore oakland flights available,atis_flight,4
atlanta would like information ground transportation,atis_ground_service,6
okay right flight united airlines atlanta washington,atis_flight,4
please list afternoon flights charlotte minneapolis,atis_flight,4
coach class flights twa columbus paul,atis_flight,4
want fly dallas san francisco,atis_flight,4
latest flight leaving boston denver,atis_flight,4
flight boston san francisco stopover fort worth dallas,atis_flight,4
list flights baltimore atlanta noon thursday nonstop,atis_flight,4
show prices first class baltimore dallas,atis_airfare,2
list day time flights pittsburgh boston,atis_flight,4
show lufthansa flights philadelphia denver,atis_flight,4
show round trip fares baltimore philadelphia,atis_airfare,2
would like fly philadelphia dallas,atis_flight,4
please list flights united airlines boston denver,atis_flight,4
flights milwaukee orlando wednesday night,atis_flight,4
explain restriction,atis_abbreviation,0
flights dfw oakland,atis_flight,4
want flight houston memphis tuesday morning,atis_flight,4
earliest flight arriving charlotte louis friday,atis_flight,4
give us air flights next wednesday cleveland miami,atis_flight,4
show flights atlanta denver june fourth,atis_flight,4
need information ground transportation airport downtown city boston,atis_ground_service,6
show prices flights baltimore dallas,atis_airfare,2
round trip fares denver philadelphia less dollars,atis_airfare,2
show flights baltimore boston,atis_flight,4
could please give information concerning american airlines flight washington dc philadelphia earliest one morning possible,atis_flight,4
show flights baltimore denver pittsburgh fly philadelphia,atis_flight,4
continental airlines fly denver san francisco,atis_flight,4
flights united airlines northwest go denver,atis_flight,4
thrift economy flights san francisco boston,atis_flight,4
also like see list flights pittsburgh atlanta,atis_flight,4
please tell type aircraft used atlanta denver noon,atis_aircraft,1
show flights dallas baltimore,atis_flight,4
give flights new york city las vegas arrive sunday,atis_flight,4
ground transportation dallas,atis_ground_service,6
evening flights flying dallas going san francisco american airlines,atis_flight,4
flights nashville louis nonstop arrive noon pm,atis_flight,4
economy flights available dallas baltimore july twenty fifth,atis_flight,4
list daily flights boston oakland using american airlines,atis_flight,4
coach fares la charlotte monday morning,atis_airfare,2
flights baltimore philadelphia please,atis_flight,4
types aircraft get first class ticket philadelphia dallas,atis_aircraft,1
give flights memphis tennessee charlotte north carolina,atis_flight,4
price first class ticket atlanta san francisco,atis_airfare,2
show flights boston denver arrive denver wednesday noon,atis_flight,4
continental fly denver san francisco,atis_flight,4
list flights denver philadelphia,atis_flight,4
please give flight times would like fly boston baltimore morning,atis_flight_time,5
show flights pittsburgh philadelphia,atis_flight,4
show flights leaving saturday sunday milwaukee phoenix,atis_flight,4
cheapest round trip airfare tacoma orlando,atis_airfare,2
need flight air canada toronto san diego layover dc,atis_flight,4
list daily flights denver baltimore,atis_flight,4
flights dallas pittsburgh monday morning,atis_flight,4
flights denver atlanta stops pittsburgh,atis_flight,4
iah mean,atis_abbreviation,0
would like fly pittsburgh atlanta us air latest time possible evening,atis_flight,4
show flights toronto,atis_flight,4
like information continental airlines flights washington philadelphia,atis_flight,4
list daily flights oakland boston using delta airlines,atis_flight,4
show flights philadelphia boston monday serve meal arrive noon,atis_flight,4
flights pittsburgh atlanta wednesday morning serves breakfast,atis_flight,4
want wednesday flights atlanta washington dc,atis_flight,4
list american airlines flights phoenix milwaukee wednesday,atis_flight,4
ground transportation available san francisco,atis_ground_service,6
us air fly washington dc denver,atis_flight,4
list flights denver san francisco pm monday,atis_flight,4
show flights delta airlines twa go atlanta morning,atis_flight,4
want go baltimore san francisco stopover denver,atis_flight,4
please give flights available boston pittsburgh wednesday next week,atis_flight,4
show flights san francisco dallas,atis_flight,4
ground transportation available baltimore,atis_ground_service,6
round trip houston las vegas nonstop,atis_flight,4
show flights denver san francisco,atis_flight,4
flights boston san francisco,atis_flight,4
sunday flights tampa charlotte,atis_flight,4
show flights baltimore dallas,atis_flight,4
airlines fly burbank denver,atis_airline,3
list flights chicago seattle continental depart saturday serve meals,atis_flight,4
list flights leaving denver arriving seattle saturday depart pm,atis_flight,4
get airport downtown dallas please,atis_flight,4
please list tuesday flights atlanta louis,atis_flight,4
would like early flight la charlotte monday morning,atis_flight,4
saturday flights las vegas montreal,atis_flight,4
show boston ground transportation,atis_ground_service,6
list flights charlotte atlanta return around pm,atis_flight,4
show first class round trip flights new york miami want cheapest first class fare please,atis_flight,4
please list flights pittsburgh baltimore arriving may seventh,atis_flight,4
airlines still offer first class,atis_airline,3
need know direct flights petersburg florida tacoma washington leaving preferably tomorrow morning,atis_flight,4
much us air boston pittsburgh daily nonstop flight,atis_airfare,2
like book flight columbus nashville please,atis_flight,4
flights detroit petersburg,atis_flight,4
airlines fly dallas baltimore,atis_airline,3
cost flights baltimore philadelphia,atis_airfare,2
show flights delta go atlanta,atis_flight,4
list flights sunday afternoon oakland dallas,atis_flight,4
show earliest nonstop flight dallas houston,atis_flight,4
want travel pittsburgh oakland around midnight could give flights,atis_flight,4
show flights boston san francisco,atis_flight,4
late afternoon flight leaving washington denver,atis_flight,4
need one first class ticket dallas fort worth san francisco,atis_airfare,2
show direct flights atlanta baltimore,atis_flight,4
show monday flights san francisco pittsburgh,atis_flight,4
please show return flights miami new york,atis_flight,4
show cheapest flights san francisco philadelphia,atis_flight,4
show price flights atlanta washington dc,atis_airfare,2
give flights pittsburgh baltimore,atis_flight,4
find travel arrangements round trip flight baltimore pittsburgh,atis_flight,4
right would let know type aircraft united airlines using flights denver san francisco would like know type aircraft use flights morning,atis_aircraft,1
show flights philadelphia dallas,atis_flight,4
earliest flight get baltimore boston,atis_flight,4
flights baltimore,atis_flight,4
hi need go cincinnati san jose california pm saturday,atis_flight,4
flights us air pittsburgh atlanta wednesday,atis_flight,4
ground transportation airport downtown boston,atis_ground_service,6
list flights baltimore philadelphia,atis_flight,4
northwest flights stopovers denver,atis_flight,4
like get flight washington oakland stopover dallas fort worth september fifteenth,atis_flight,4
wednesday morning flights pittsburgh boston,atis_flight,4
round trip cost first class ticket boston san francisco,atis_airfare,2
lowest round trip fare dallas city,atis_airfare,2
give flights boston san francisco leaving early today,atis_flight,4
ground transportation oakland,atis_ground_service,6
please list pm flights boston pittsburgh,atis_flight,4
show flights philadelphia san francisco one stop dallas,atis_flight,4
evening flights available baltimore philadelphia,atis_flight,4
show flights los angeles pittsburgh tuesday,atis_flight,4
cheapest one way fare city another,atis_airfare,2
like find flight charlotte las vegas make stop louis,atis_flight,4
live denver like make trip pittsburgh,atis_flight,4
list flights baltimore atlanta noon thursday,atis_flight,4
show cheapest one way flight san francisco boston leaving san francisco pm,atis_flight,4
give flights boston philadelphia next week arriving lunch,atis_flight,4
flights denver philadelphia saturday,atis_flight,4
flight information january twenty third denver san francisco,atis_flight,4
like find cheapest one way fare baltimore denver,atis_airfare,2
need flight sunday long beach columbus,atis_flight,4
fares flights charlotte newark tuesday wednesday,atis_airfare,2
show itinerary connecting flight boston denver departs boston,atis_flight,4
find flight atlanta baltimore,atis_flight,4
would like early morning nonstop flight new york las vegas february twenty eighth,atis_flight,4
describe fare code qx,atis_abbreviation,0
earliest flight friday washington san francisco,atis_flight,4
american flights chicago los angeles morning,atis_flight,4
show flights pittsburgh oakland,atis_flight,4
list flights chicago seattle continental airlines depart saturday noon include meal,atis_flight,4
would like first flight houston dallas march first last flight houston dallas march first,atis_flight,4
please give ground transportation information denver,atis_ground_service,6
show united flights bwi denver,atis_flight,4
flights chicago indianapolis,atis_flight,4
show fare us flight philadelphia baltimore,atis_airfare,2
first class price san francisco pittsburgh round trip,atis_airfare,2
flights minneapolis chicago,atis_flight,4
